{"addedPaths":[{"class":"PLATFORM-CONTRACT","mutationWindows":["S2-P1"],"path":"apps/hub/migrations/002_workspace_foundation.sql"},{"class":"GENERATED","mutationWindows":["S2-P1"],"path":"apps/hub/migrations/atlas.sum"},{"class":"PLATFORM-CONTRACT","mutationWindows":["S2-P1"],"path":"scripts/run-hub-migrations.mjs"},{"class":"PLATFORM-CONTRACT","mutationWindows":["S2-P1"],"path":"tests/implementation/r1-s2-postgres.test.mjs"},{"class":"PLATFORM-CONTRACT","mutationWindows":["S2-P2"],"path":"apps/hub/src/workspace/errors.ts"},{"class":"PLATFORM-CONTRACT","mutationWindows":["S2-P2"],"path":"apps/hub/src/workspace/module.ts"},{"class":"PLATFORM-CONTRACT","mutationWindows":["S2-P2"],"path":"apps/hub/src/workspace/routes.ts"},{"class":"PLATFORM-CONTRACT","mutationWindows":["S2-P2"],"path":"apps/hub/src/workspace/store.ts"},{"class":"PLATFORM-CONTRACT","mutationWindows":["S2-P2"],"path":"scripts/generate-r1-s2-contracts.mjs"},{"class":"GENERATED","mutationWindows":["S2-P2"],"path":"apps/hub/src/generated/s2-routes.ts"},{"class":"GENERATED","mutationWindows":["S2-P2"],"path":"apps/web/src/generated/workspace-client.ts"},{"class":"PLATFORM-CONTRACT","mutationWindows":["S2-P2"],"path":"tests/implementation/r1-s2-http.test.mjs"},{"class":"PLATFORM-CONTRACT","mutationWindows":["S2-P3"],"path":"tests/implementation/r1-s2-reads.test.mjs"},{"class":"PLATFORM-CONTRACT","mutationWindows":["S2-P4"],"path":"apps/web/src/app/query-client.tsx"},{"class":"PLATFORM-CONTRACT","mutationWindows":["S2-P4"],"path":"apps/web/src/app/router.tsx"},{"class":"PLATFORM-CONTRACT","mutationWindows":["S2-P4"],"path":"apps/web/src/app/shell.tsx"},{"class":"PLATFORM-CONTRACT","mutationWindows":["S2-P4"],"path":"apps/web/src/routes/__root.tsx"},{"class":"PLATFORM-CONTRACT","mutationWindows":["S2-P4"],"path":"apps/web/src/routes/index.tsx"},{"class":"PLATFORM-CONTRACT","mutationWindows":["S2-P4"],"path":"apps/web/src/routes/setup.tsx"},{"class":"PLATFORM-CONTRACT","mutationWindows":["S2-P4"],"path":"apps/web/src/routes/workspace-new.tsx"},{"class":"PLATFORM-CONTRACT","mutationWindows":["S2-P4"],"path":"apps/web/src/features/identity-access/api.ts"},{"class":"PLATFORM-CONTRACT","mutationWindows":["S2-P4"],"path":"apps/web/src/features/workspace/api.ts"},{"class":"PLATFORM-CONTRACT","mutationWindows":["S2-P4"],"path":"apps/web/src/features/workspace/components/workspace-create-form.tsx"},{"class":"PLATFORM-CONTRACT","mutationWindows":["S2-P4"],"path":"apps/web/src/features/workspace/components/workspace-summary.tsx"},{"class":"PLATFORM-CONTRACT","mutationWindows":["S2-P4"],"path":"tests/implementation/r1-s2-live-setup.mjs"},{"class":"PLATFORM-CONTRACT","mutationWindows":["S2-P4"],"path":"tests/implementation/r1-s2-live-runner.sh"},{"class":"PLATFORM-CONTRACT","mutationWindows":["S2-P4"],"path":"tests/implementation/r1-s2-live-browser.spec.mjs"},{"class":"PLATFORM-CONTRACT","mutationWindows":["S2-P5"],"path":"docs/evidence/4f/4f-r1-s2-implementation-result.md"}],"adoptedExistingPaths":[{"class":"PLATFORM-CONTRACT","digest":"5d27a988932a693fd54baf4d82ca589eba474ac2765139056f251401e4a82c7d","path":"docs/evidence/4f/4f-r1-s2-physical-convergence.md"}],"bootstrapPaths":[{"class":"PLATFORM-CONTRACT","outputDigest":"d393b3bda1385dded24bba43ff9424c067894c55cc641c50d41537b38e2372a9","path":"packages/profile-compiler/schemas/s2-workspace-foundation-migration.schema.json"},{"class":"PLATFORM-CONTRACT","outputDigest":"47c3c8eb0d0698c5fbe1b49ebe0e90370c91695630a79665bb1d9100287d9ef7","path":"scripts/check-r1-s2-migration.mjs"},{"class":"PLATFORM-CONTRACT","outputDigest":"0afe0a060f4a8e0b0e2e3d61ff00feddf0020c3a1bb55b7f6c26b5037baca596","path":"scripts/record-r1-s2-part-pass.mjs"},{"class":"PLATFORM-CONTRACT","outputDigest":"97fc12e845c0100a1f680396262109b8622b7f5185cd3d4663bd3cc895ea0dd3","path":"scripts/record-r1-s2-receipt.mjs"},{"class":"PLATFORM-CONTRACT","outputDigest":"02bfacaa86dcd832e19a8a3d54c56031b68f97e3ef861dadc1c7ff663a174269","path":"tests/implementation/r1-s2-migration-custody.test.mjs"}],"changedPaths":[{"class":"PLATFORM-CONTRACT","mutationWindows":["S2-P2"],"path":"apps/hub/src/server.ts","priorDigest":"23ff8df9436bac3da4827a3a1a00542ac44b1685e26d0027070c448c791002c7"},{"class":"PLATFORM-CONTRACT","mutationWindows":["S2-P2"],"path":"apps/hub/src/platform/config.ts","priorDigest":"8731e597759a4ff6cb6d02cd93bf23b9563d882f3faa15ad141b524be12cb688"},{"class":"PLATFORM-CONTRACT","mutationWindows":["S2-P2"],"path":"scripts/check-import-law.mjs","priorDigest":"44f1c19384d773fc1a0b1d11d8835ff972b80748926830ea18f0159f4e440ed3"},{"class":"PLATFORM-CONTRACT","mutationWindows":["S2-P2","S2-P4"],"path":"tests/repository/import-law.test.mjs","priorDigest":"07e9df3d8a6e83b3b5ac358097c7fa88ebfbdeeffa29fa3db4ae7c3645f68fb6"},{"class":"PLATFORM-CONTRACT","mutationWindows":["S2-P2"],"path":"package.json","priorDigest":"d49d6371abf496070953ccec9db38abdc31911ae6ab9fab43d9d1a44ce5527a0"},{"class":"PLATFORM-CONTRACT","mutationWindows":["S2-P3"],"path":"apps/hub/src/identity-access/module.ts","priorDigest":"3ec1c9543d73f58708e1dd0b60720fad293677f937f2054043f3b88525f77e45"},{"class":"PLATFORM-CONTRACT","mutationWindows":["S2-P3"],"path":"apps/hub/src/identity-access/store.ts","priorDigest":"0f04be3cc5a20a27cd57918d2df5452b5038fab63f84b2203a60c7cb06a77303"},{"class":"PLATFORM-CONTRACT","mutationWindows":["S2-P3"],"path":"apps/hub/src/identity-access/routes.ts","priorDigest":"ee725d4b53109a6016098498d9860c5a28c5384a082412908ad7575f26683882"},{"class":"PLATFORM-CONTRACT","mutationWindows":["S2-P4"],"path":"apps/web/src/main.tsx","priorDigest":"9a603d3b1c1397053ffc0e51e7c60cf591c161ee4c7e73d5a81ffe3504793903"},{"class":"PLATFORM-CONTRACT","mutationWindows":["S2-P4"],"path":"apps/hub/src/http/app.ts","priorDigest":"3bf06645e4cf442d177d972425d14cb60942526d5d18a4bf9475669c4811b3f6"},{"class":"PLATFORM-CONTRACT","mutationWindows":["S2-P4"],"path":".github/workflows/verify.yml","priorDigest":"a02905914909d676c90e253ad22fd74274ca40a4fb4f1b8cf2491f04fe5f6fae"},{"class":"PLATFORM-CONTRACT","mutationWindows":["S2-P0","S2-P5"],"path":"docs/roadmap.md","priorDigest":"d953f3bfd9796fa7171be41118be956dcc16596db46094e0f24fb02fca263815"},{"class":"PLATFORM-CONTRACT","mutationWindows":["S2-P0","S2-P5"],"path":"docs/index.md","priorDigest":"47d89e60e502a4ed22132f4abeb293019be3bf2950c30866f7d6f788ec11811a"}],"controlArtifacts":[{"kind":"conexus.r1-s2-workspace-foundation-migration/v1","path":"profiles/r1/v1/s2-workspace-foundation-migration.json","publicationPhase":"S2-P0"},{"kind":"conexus.r1-s2-migration-plan-validation/v1","path":"runtime/r1/.conexus/s2-migration-plan-validation.json","publicationPhase":"S2-P0"},{"kind":"conexus.r1-s2-part-pass/v1","path":"runtime/r1/.conexus/s2-p0-pass.json","publicationPhase":"S2-P0"},{"kind":"conexus.r1-s2-part-pass/v1","path":"runtime/r1/.conexus/s2-p1-pass.json","publicationPhase":"S2-P1"},{"kind":"conexus.r1-s2-part-pass/v1","path":"runtime/r1/.conexus/s2-p2-pass.json","publicationPhase":"S2-P2"},{"kind":"conexus.r1-s2-part-pass/v1","path":"runtime/r1/.conexus/s2-p3-pass.json","publicationPhase":"S2-P3"},{"kind":"conexus.r1-s2-part-pass/v1","path":"runtime/r1/.conexus/s2-p4-pass.json","publicationPhase":"S2-P4"},{"kind":"conexus.r1-s2-part-pass/v1","path":"runtime/r1/.conexus/s2-p5-pass.json","publicationPhase":"S2-P5"},{"kind":"conexus.r1-s2-conformance-result/v1","path":"runtime/r1/.conexus/s2-conformance-result.json","publicationPhase":"S2-P5"},{"kind":"conexus.r1-s2-ownership-manifest/v1","path":"runtime/r1/.conexus/s2-ownership-manifest.json","publicationPhase":"S2-P5"},{"kind":"conexus.r1-s2-generation-receipt/v1","path":"runtime/r1/.conexus/s2-generation-receipt.json","publicationPhase":"S2-P5"}],"custodyRoots":["apps/hub","apps/web","packages/canonical-json","packages/profile-compiler","profiles/r1/v1","runtime/r1"],"expectedProductDelta":{"appOwnedMutations":0,"existingOperationProjectionChanged":["IAM-01"],"laterSlicesAuthorized":[],"loginRolesAdded":["hub_ws01_command","hub_s2_read"],"operationsRealized":["WS-01","WS-02"],"permissionsAdded":[],"schemasAdded":["workspace"],"tablesAdded":["workspace.workspace","workspace.operation_idempotency","iam.workspace_membership"]},"generatedRoots":[{"class":"GENERATED","mutationWindows":["S2-P4"],"priorTreeDigest":"b066c09a19d005482a05097fac924bbbeacaf147603755a30a47b420ecf597ae","producer":"npm run r1:s2:build","root":"apps/hub/public"}],"kind":"conexus.r1-s2-workspace-foundation-migration/v1","migrationId":"R1-S2-WORKSPACE-FOUNDATION","parts":[{"id":"S2-P0","requiredProofs":["S2:CUSTODY"]},{"id":"S2-P1","requiredProofs":["S2:MIGRATION","S2:POSTGRES"]},{"id":"S2-P2","requiredProofs":["S2:GENERATED","S2:HTTP","S2:HUB-TYPECHECK","S2:IMPORT-LAW"]},{"id":"S2-P3","requiredProofs":["S2:HUB-TYPECHECK","S2:READS"]},{"id":"S2-P4","requiredProofs":["REPOSITORY:NPM-CI","REPOSITORY:VERIFY","S2:IMPORT-LAW","S2:LIVE","S2:WEB-TYPECHECK"]},{"id":"S2-P5","requiredProofs":["REPOSITORY:NPM-CI","REPOSITORY:VERIFY","S2:CUSTODY","S2:GENERATED","S2:HTTP","S2:HUB-TYPECHECK","S2:IMPORT-LAW","S2:LIVE","S2:MIGRATION","S2:POSTGRES","S2:READS","S2:WEB-TYPECHECK"]}],"prior":{"a0ManifestDigest":"886088717916d48f59026493ed649e9eaef50c3af6706b2887a4614ecb1a9ca9","a0ReceiptDigest":"1633c1fee1942b71e348f9d26c6db3cb0e6577ac6535e12bf5fc3bb6c0dcfdd7","migration001Digest":"d27e76b972145bc3a6bf669d4fd32734fc06153d07cddaf1072c6b29845b112f"},"protectedExistingPaths":[{"class":"PLATFORM-CONTRACT","digest":"c6e1b26332ea776a9b6f6b15c88b349efd4c217c5eb6171ca61bd1976dac6da9","path":"runtime/r1/.conexus/a0-conformance-result.json"},{"class":"PLATFORM-CONTRACT","digest":"1633c1fee1942b71e348f9d26c6db3cb0e6577ac6535e12bf5fc3bb6c0dcfdd7","path":"runtime/r1/.conexus/a0-generation-receipt.json"},{"class":"PLATFORM-CONTRACT","digest":"0f39ebbaa699af5c39a12d924269318ed740a78b63f6c6a5e65072b2225a5e4a","path":"runtime/r1/.conexus/a0-migration-plan-validation.json"},{"class":"PLATFORM-CONTRACT","digest":"886088717916d48f59026493ed649e9eaef50c3af6706b2887a46